{
    "$schema": "../../schemas/LessonConfig.schema.json",
    "name": "Advanced Greetings 2",
    "category": "vocabulary",
    "topic": "Greetings",
    "description": "Start thoughtful conversations and check in indirectly by noticing context, recalling updates, and inviting someone to share.",
    "level": "B2",
    "order": 4,
    "estimated-minutes": 15,
    "content-settings": {},
    "quiz-settings": {
        "mix-with-lesson": false,
        "randomize-questions": false,
        "shuffle-questions": false,
        "shuffle-answers": true
    },
    "content": "./content.json",
    "quiz": "./quiz.json"
}
