{
    "$schema": "../schemas/LessonConfig.schema.json",
    "name": "Ambiguous, Vague, Equivocal and Obscure",
    "category": "vocabulary",
    "topic": "Adjectives",
    "description": "This lesson tells learners about the differences between ambiguous, vague, equivocal, and obscure.",
    "level": "B2",
    "order": 1,
    "estimated-minutes": 10,
    "content-settings": {},
    "quiz-settings": {
        "mix-with-lesson": true,
        "randomize-questions": false,
        "shuffle-questions": false,
        "shuffle-answers": false
    },

    "content": "./content.json",
    "quiz": "./quiz.json"
}