{
    "$schema": "../../schemas/LessonConfig.schema.json",
    "name": "Locations and Destinations 1",
    "category": "vocabulary",
    "topic": "Places",
    "description": "Learn words for familiar places around town and in the community.",
    "level": "A1",
    "order": 9,
    "estimated-minutes": 15,
    "content-settings": {},
    "quiz-settings": {
        "mix-with-lesson": false,
        "randomize-questions": false,
        "shuffle-questions": false,
        "shuffle-answers": true
    },
    "content": "./content.json",
    "quiz": "./quiz.json"
}
