{
    "$schema": "../../schemas/LessonConfig.schema.json",
    "name": "Daily Routine Verbs",
    "category": "vocabulary",
    "topic": "Verbs",
    "description": "Learn common verbs for daily routines and everyday habits.",
    "level": "A1",
    "order": 12,
    "estimated-minutes": 20,
    "content-settings": {},
    "quiz-settings": {
        "mix-with-lesson": false,
        "randomize-questions": false,
        "shuffle-questions": true,
        "shuffle-answers": true
    },
    "content": "./content.json",
    "quiz": "./quiz.json"
}
