{
    "$schema": "../../schemas/LessonConfig.schema.json",
    "name": "Basic Foods and Drinks 1",
    "category": "vocabulary",
    "topic": "Food and Drinks",
    "description": "Learn common food and drink words for everyday meals.",
    "level": "A1",
    "order": 7,
    "estimated-minutes": 15,
    "content-settings": {},
    "quiz-settings": {
        "mix-with-lesson": false,
        "randomize-questions": false,
        "shuffle-questions": false,
        "shuffle-answers": true
    },
    "content": "./content.json",
    "quiz": "./quiz.json"
}
