{
    "$schema": "../../schemas/LessonConfig.schema.json",
    "name": "Numbers",
    "category": "vocabulary",
    "topic": "Numbers",
    "description": "Learn cardinal numbers, number groups, and how to combine tens, hundreds, and thousands in English.",
    "level": "A1",
    "order": 3,
    "estimated-minutes": 20,
    "content-settings": {},
    "quiz-settings": {
        "mix-with-lesson": false,
        "randomize-questions": false,
        "shuffle-questions": true,
        "shuffle-answers": true
    },
    "content": "./content.json",
    "quiz": "./quiz.json"
}
